{
  "schema_version": "1.0.0",
  "feed_id": "events_calendar",
  "last_updated": "2026-07-13T11:42:03+09:00",
  "source": {
    "label": "Curated Phase1 calendar (IFES / CB published)",
    "url": "https://www.electionguide.org/",
    "disclaimer_ja": "静的キュレーション（best-effort）。IFESスクレイプ本実装は次イテレーション。中銀日程は各中銀公表カレンダー準拠の近似。",
    "curated_yaml": "curated/events_calendar_phase1.yaml"
  },
  "meta": {
    "event_count": 45,
    "by_type": {
      "election": 17,
      "central_bank_meeting": 28
    },
    "notes_ja": "Phase1国の主要選挙＋主要中銀会合の静的キュレーション。 IFESスクレイプ本実装は次イテレーション。日付は公表ベース最良推定。\n",
    "phase1_window": "2025-2026 (+ next-window placeholders)"
  },
  "events": [
    {
      "id": "elec-us-2026-midterm",
      "type": "election",
      "subtype": "midterm",
      "iso2": "US",
      "name_ja": "米国中間選挙",
      "name_en": "US midterm elections",
      "date": "2026-11-03",
      "status": "scheduled",
      "source_ref": "IFES/curated:US:2026-midterm",
      "veritas": "⚠️"
    },
    {
      "id": "elec-br-2026-presidential",
      "type": "election",
      "subtype": "presidential",
      "iso2": "BR",
      "name_ja": "ブラジル大統領選挙",
      "name_en": "Brazil presidential election",
      "date": "2026-10-04",
      "status": "scheduled",
      "source_ref": "IFES/curated:BR:2026-presidential",
      "veritas": "⚠️"
    },
    {
      "id": "elec-ca-2025-federal",
      "type": "election",
      "subtype": "federal",
      "iso2": "CA",
      "name_ja": "カナダ連邦選挙（2025）",
      "name_en": "Canada federal election 2025",
      "date": "2025-04-28",
      "status": "held",
      "source_ref": "IFES/curated:CA:2025-federal",
      "veritas": "⚠️"
    },
    {
      "id": "elec-de-2025-federal",
      "type": "election",
      "subtype": "federal",
      "iso2": "DE",
      "name_ja": "ドイツ連邦議会選挙（2025）",
      "name_en": "Germany federal election 2025",
      "date": "2025-02-23",
      "status": "held",
      "source_ref": "IFES/curated:DE:2025-federal",
      "veritas": "⚠️"
    },
    {
      "id": "elec-jp-2025-upper",
      "type": "election",
      "subtype": "upper_house",
      "iso2": "JP",
      "name_ja": "日本参議院選挙（2025）",
      "name_en": "Japan House of Councillors election 2025",
      "date": "2025-07-20",
      "status": "held",
      "source_ref": "IFES/curated:JP:2025-upper",
      "veritas": "⚠️"
    },
    {
      "id": "elec-ph-2025-midterm",
      "type": "election",
      "subtype": "midterm",
      "iso2": "PH",
      "name_ja": "フィリピン中間選挙（2025）",
      "name_en": "Philippines midterm elections 2025",
      "date": "2025-05-12",
      "status": "held",
      "source_ref": "IFES/curated:PH:2025-midterm",
      "veritas": "⚠️"
    },
    {
      "id": "elec-sg-2025-ge",
      "type": "election",
      "subtype": "general",
      "iso2": "SG",
      "name_ja": "シンガポール総選挙（2025）",
      "name_en": "Singapore general election 2025",
      "date": "2025-05-03",
      "status": "held",
      "source_ref": "IFES/curated:SG:2025-ge",
      "veritas": "⚠️"
    },
    {
      "id": "elec-tr-2028-presidential",
      "type": "election",
      "subtype": "presidential",
      "iso2": "TR",
      "name_ja": "トルコ大統領選挙（次回予定枠）",
      "name_en": "Türkiye presidential election (next window)",
      "date": "2028-05-01",
      "status": "tentative",
      "source_ref": "IFES/curated:TR:2028-window",
      "veritas": "⚠️"
    },
    {
      "id": "elec-vn-2026-party-congress",
      "type": "election",
      "subtype": "party_congress",
      "iso2": "VN",
      "name_ja": "ベトナム共産党大会（2026）",
      "name_en": "Vietnam Communist Party Congress 2026",
      "date": "2026-01-15",
      "status": "held_approx",
      "source_ref": "curated:VN:2026-congress",
      "veritas": "⚠️"
    },
    {
      "id": "elec-in-2029-loksabha",
      "type": "election",
      "subtype": "general",
      "iso2": "IN",
      "name_ja": "インド総選挙（次回枠・参考）",
      "name_en": "India Lok Sabha (next window)",
      "date": "2029-04-01",
      "status": "tentative",
      "source_ref": "IFES/curated:IN:2029-window",
      "veritas": "⚠️"
    },
    {
      "id": "elec-id-2029-presidential",
      "type": "election",
      "subtype": "presidential",
      "iso2": "ID",
      "name_ja": "インドネシア大統領選挙（次回枠）",
      "name_en": "Indonesia presidential (next window)",
      "date": "2029-02-01",
      "status": "tentative",
      "source_ref": "IFES/curated:ID:2029-window",
      "veritas": "⚠️"
    },
    {
      "id": "elec-kr-2027-presidential",
      "type": "election",
      "subtype": "presidential",
      "iso2": "KR",
      "name_ja": "韓国大統領選挙（次回枠）",
      "name_en": "Korea presidential (next window)",
      "date": "2027-03-01",
      "status": "tentative",
      "source_ref": "IFES/curated:KR:2027-window",
      "veritas": "⚠️"
    },
    {
      "id": "elec-tw-2028-presidential",
      "type": "election",
      "subtype": "presidential",
      "iso2": "TW",
      "name_ja": "台湾総統選挙（次回枠）",
      "name_en": "Taiwan presidential (next window)",
      "date": "2028-01-01",
      "status": "tentative",
      "source_ref": "IFES/curated:TW:2028-window",
      "veritas": "⚠️"
    },
    {
      "id": "elec-fr-2027-presidential",
      "type": "election",
      "subtype": "presidential",
      "iso2": "FR",
      "name_ja": "フランス大統領選挙（次回枠）",
      "name_en": "France presidential (next window)",
      "date": "2027-04-01",
      "status": "tentative",
      "source_ref": "IFES/curated:FR:2027-window",
      "veritas": "⚠️"
    },
    {
      "id": "elec-gb-2029-general",
      "type": "election",
      "subtype": "general",
      "iso2": "GB",
      "name_ja": "英国総選挙（次回枠）",
      "name_en": "UK general election (next window)",
      "date": "2029-01-01",
      "status": "tentative",
      "source_ref": "IFES/curated:GB:2029-window",
      "veritas": "⚠️"
    },
    {
      "id": "elec-my-2027-ge",
      "type": "election",
      "subtype": "general",
      "iso2": "MY",
      "name_ja": "マレーシア総選挙（次回枠）",
      "name_en": "Malaysia GE (next window)",
      "date": "2027-11-01",
      "status": "tentative",
      "source_ref": "IFES/curated:MY:2027-window",
      "veritas": "⚠️"
    },
    {
      "id": "elec-th-2027-general",
      "type": "election",
      "subtype": "general",
      "iso2": "TH",
      "name_ja": "タイ総選挙（次回枠）",
      "name_en": "Thailand general (next window)",
      "date": "2027-05-01",
      "status": "tentative",
      "source_ref": "IFES/curated:TH:2027-window",
      "veritas": "⚠️"
    },
    {
      "id": "cb-fomc-2026-01",
      "type": "central_bank_meeting",
      "subtype": "fomc",
      "iso2": "US",
      "name_ja": "FOMC（2026-01）",
      "name_en": "FOMC January 2026",
      "date": "2026-01-28",
      "status": "scheduled",
      "source_ref": "FRB:FOMC:2026",
      "veritas": "⚠️"
    },
    {
      "id": "cb-fomc-2026-03",
      "type": "central_bank_meeting",
      "subtype": "fomc",
      "iso2": "US",
      "name_ja": "FOMC（2026-03）",
      "name_en": "FOMC March 2026",
      "date": "2026-03-18",
      "status": "scheduled",
      "source_ref": "FRB:FOMC:2026",
      "veritas": "⚠️"
    },
    {
      "id": "cb-fomc-2026-05",
      "type": "central_bank_meeting",
      "subtype": "fomc",
      "iso2": "US",
      "name_ja": "FOMC（2026-05）",
      "name_en": "FOMC May 2026",
      "date": "2026-05-06",
      "status": "scheduled",
      "source_ref": "FRB:FOMC:2026",
      "veritas": "⚠️"
    },
    {
      "id": "cb-fomc-2026-06",
      "type": "central_bank_meeting",
      "subtype": "fomc",
      "iso2": "US",
      "name_ja": "FOMC（2026-06）",
      "name_en": "FOMC June 2026",
      "date": "2026-06-17",
      "status": "scheduled",
      "source_ref": "FRB:FOMC:2026",
      "veritas": "⚠️"
    },
    {
      "id": "cb-fomc-2026-07",
      "type": "central_bank_meeting",
      "subtype": "fomc",
      "iso2": "US",
      "name_ja": "FOMC（2026-07）",
      "name_en": "FOMC July 2026",
      "date": "2026-07-29",
      "status": "scheduled",
      "source_ref": "FRB:FOMC:2026",
      "veritas": "⚠️"
    },
    {
      "id": "cb-fomc-2026-09",
      "type": "central_bank_meeting",
      "subtype": "fomc",
      "iso2": "US",
      "name_ja": "FOMC（2026-09）",
      "name_en": "FOMC September 2026",
      "date": "2026-09-16",
      "status": "scheduled",
      "source_ref": "FRB:FOMC:2026",
      "veritas": "⚠️"
    },
    {
      "id": "cb-fomc-2026-11",
      "type": "central_bank_meeting",
      "subtype": "fomc",
      "iso2": "US",
      "name_ja": "FOMC（2026-11）",
      "name_en": "FOMC November 2026",
      "date": "2026-11-04",
      "status": "scheduled",
      "source_ref": "FRB:FOMC:2026",
      "veritas": "⚠️"
    },
    {
      "id": "cb-fomc-2026-12",
      "type": "central_bank_meeting",
      "subtype": "fomc",
      "iso2": "US",
      "name_ja": "FOMC（2026-12）",
      "name_en": "FOMC December 2026",
      "date": "2026-12-16",
      "status": "scheduled",
      "source_ref": "FRB:FOMC:2026",
      "veritas": "⚠️"
    },
    {
      "id": "cb-boj-2026-01",
      "type": "central_bank_meeting",
      "subtype": "mpm",
      "iso2": "JP",
      "name_ja": "日銀金融政策決定会合（2026-01）",
      "name_en": "BoJ MPM January 2026",
      "date": "2026-01-23",
      "status": "scheduled",
      "source_ref": "BoJ:MPM:2026",
      "veritas": "⚠️"
    },
    {
      "id": "cb-boj-2026-03",
      "type": "central_bank_meeting",
      "subtype": "mpm",
      "iso2": "JP",
      "name_ja": "日銀金融政策決定会合（2026-03）",
      "name_en": "BoJ MPM March 2026",
      "date": "2026-03-19",
      "status": "scheduled",
      "source_ref": "BoJ:MPM:2026",
      "veritas": "⚠️"
    },
    {
      "id": "cb-boj-2026-04",
      "type": "central_bank_meeting",
      "subtype": "mpm",
      "iso2": "JP",
      "name_ja": "日銀金融政策決定会合（2026-04）",
      "name_en": "BoJ MPM April 2026",
      "date": "2026-04-28",
      "status": "scheduled",
      "source_ref": "BoJ:MPM:2026",
      "veritas": "⚠️"
    },
    {
      "id": "cb-boj-2026-06",